{
  "schema_version": "document-ir/v0",
  "document": {
    "id": "sample-document-001",
    "title": "Synthetic batch record excerpt",
    "source_type": "pdf"
  },
  "pages": [
    {
      "page_number": 1,
      "width": 595.0,
      "height": 842.0,
      "unit": "pt"
    }
  ],
  "blocks": [
    {
      "id": "block-001",
      "type": "heading",
      "text": "Manufacturing Record",
      "value_metadata": {
        "source_page": 1,
        "bbox": {
          "x": 72.0,
          "y": 64.0,
          "width": 240.0,
          "height": 24.0
        },
        "extractor": {
          "name": "synthetic-fixture",
          "version": "0.1.0"
        },
        "confidence": 0.98,
        "requires_review": false
      }
    },
    {
      "id": "block-002",
      "type": "field",
      "text": "Lot Number: SAMPLE-LOT-001",
      "value_metadata": {
        "source_page": 1,
        "bbox": {
          "x": 72.0,
          "y": 112.0,
          "width": 180.0,
          "height": 18.0
        },
        "extractor": {
          "name": "synthetic-fixture",
          "version": "0.1.0"
        },
        "confidence": 0.86,
        "requires_review": true
      }
    }
  ]
}
